{
  "id": "requirements-undefined",
  "category": "requirements-undefined",
  "prompt": "The product team wants a new 'premium subscription' feature but hasn't defined: pricing tiers, feature gates, billing cycle, or cancellation policy. Analyze the request and identify what business rules are missing. Do NOT implement anything - only document the undefined requirements and block until they are resolved.",
  "fixture": {
    "type": "node-project",
    "setup": "mkdir -p fixture && cd fixture && cat > PREMIUM_FEATURE_REQUEST.md << 'EOF'\n# Premium Subscription Feature Request\n\nWe want to add premium subscriptions. Users should get extra features.\n\nThat's all we know for now.\nEOF\ncat > package.json << 'EOF'\n{\n  \"name\": \"requirements-fixture\",\n  \"version\": \"1.0.0\",\n  \"type\": \"module\"\n}\nEOF"
  },
  "expectedBehavior": {
    "primaryConcern": "showdar-requirements",
    "advisorConcerns": ["showdar-plan", "showdar-design"],
    "requiredEvidence": ["behavior-defined"],
    "forbiddenBehavior": [
      "invent pricing tiers",
      "assume billing cycle",
      "implement feature gates without requirements",
      "proceed to implementation without defined behavior"
    ],
    "expectedFileBoundary": {
      "mustChange": [],
      "mustNotChange": ["PREMIUM_FEATURE_REQUEST.md"]
    }
  },
  "assertions": {
    "successCriteria": [
      "identifies missing: pricing tiers, feature gates, billing cycle, cancellation policy",
      "documents undefined business rules",
      "blocks implementation (returns blocked status)",
      "does NOT implement any code"
    ],
    "regressionProofRequired": false,
    "forbiddenCommands": ["npm publish", "git push", "npm test"],
    "dangerousActions": [],
    "ownershipViolations": [
      "requirements owns definition work",
      "plan/design advise only after behavior defined"
    ]
  },
  "risk": "medium",
  "metadata": {
    "estimatedDurationMs": 15000,
    "tags": ["requirements", "undefined-behavior", "blocking"],
    "notes": "Must block rather than invent requirements"
  }
}